{
  "mime_type": "application/json/ons/eq",
  "language": "en",
  "schema_version": "0.0.1",
  "data_version": "0.0.3",
  "survey_id": "0",
  "title": "Question Validation Test",
  "theme": "default",
  "description": "A questionnaire to test use of the question title in validation",
  "metadata": [
    {
      "name": "user_id",
      "type": "string"
    },
    {
      "name": "period_id",
      "type": "string"
    },
    {
      "name": "ru_name",
      "type": "string"
    }
  ],
  "questionnaire_flow": {
    "type": "Linear",
    "options": {
      "summary": {
        "collapsible": false
      }
    }
  },
  "sections": [
    {
      "id": "mutually-exclusive-checkbox-section",
      "groups": [
        {
          "blocks": [
            {
              "type": "Question",
              "id": "total-block",
              "question": {
                "id": "total-question",
                "title": "Total",
                "description": [
                  "Enter a number to breakdown in subsequent questions and calculated summary."
                ],
                "type": "General",
                "answers": [
                  {
                    "id": "total-answer",
                    "label": "Total",
                    "mandatory": true,
                    "type": "Number",
                    "decimal_places": 2,
                    "minimum": {
                      "value": 0,
                      "exclusive": true
                    }
                  }
                ]
              }
            },
            {
              "type": "Question",
              "id": "date-block",
              "question": {
                "answers": [
                  {
                    "id": "date-range-from-answer",
                    "label": "Period from",
                    "mandatory": true,
                    "type": "Date"
                  },
                  {
                    "id": "date-range-to-answer",
                    "label": "Period to",
                    "mandatory": true,
                    "type": "Date"
                  }
                ],
                "id": "date-range-question",
                "title": "Date range",
                "warning": "The period to date must be after the period from date",
                "type": "DateRange",
                "validation": {
                  "messages": {
                    "INVALID_DATE_RANGE": "The date range specified is invalid"
                  }
                }
              }
            }
          ],
          "id": "dates"
        },
        {
          "id": "calculated-question-group",
          "title": "Calculated Question Group",
          "blocks": [
            {
              "type": "Question",
              "id": "breakdown-block",
              "question": {
                "id": "breakdown-question",
                "title": "Breakdown",
                "type": "Calculated",
                "calculations": [
                  {
                    "calculation_type": "sum",
                    "answer_id": "total-answer",
                    "answers_to_calculate": ["breakdown-1", "breakdown-2"],
                    "conditions": ["less than"]
                  }
                ],
                "answers": [
                  {
                    "id": "breakdown-1",
                    "label": "Breakdown 1",
                    "mandatory": false,
                    "decimal_places": 2,
                    "type": "Currency",
                    "currency": "GBP"
                  },
                  {
                    "id": "breakdown-2",
                    "label": "Breakdown 2",
                    "mandatory": false,
                    "decimal_places": 2,
                    "type": "Currency",
                    "currency": "GBP"
                  }
                ],
                "validation": {
                  "messages": {
                    "TOTAL_SUM_NOT_LESS_THAN": "Enter answers that add up to or are less than total answer"
                  }
                }
              }
            }
          ]
        },
        {
          "id": "mutually-exclusive-mandatory-group",
          "title": "Mutually Exclusive Group",
          "blocks": [
            {
              "type": "Question",
              "id": "mutually-exclusive-checkbox",
              "question": {
                "id": "mutually-exclusive-checkbox-question",
                "type": "MutuallyExclusive",
                "title": "Were you a resident at any of the following addresses?",
                "mandatory": true,
                "answers": [
                  {
                    "id": "checkbox-answer",
                    "label": "Select answer",
                    "type": "Checkbox",
                    "mandatory": false,
                    "options": [
                      {
                        "label": "7 Evelyn Street, Barry",
                        "value": "7 Evelyn Street, Barry"
                      },
                      {
                        "label": "251 Argae Lane, Barry",
                        "value": "251 Argae Lane, Barry"
                      }
                    ]
                  },
                  {
                    "id": "checkbox-exclusive-answer",
                    "mandatory": false,
                    "type": "Checkbox",
                    "options": [
                      {
                        "label": "I prefer not to say",
                        "description": "Some description",
                        "value": "I prefer not to say"
                      }
                    ]
                  }
                ],
                "validation": {
                  "messages": {
                    "MANDATORY_QUESTION": "Select an answer to continue"
                  }
                }
              }
            }
          ]
        }
      ]
    }
  ]
}
